token,mean_abs_shap
photograph florence tintype photograph renaissance photograph florence italy florence tintype early renaissance photograph photograph renaissance italy,9.117171116958543e-05
photograph typewriter typewriter photograph,0.00029604415638965825
photography delicious detailed photorealistic food photography photorealistic engine art photography photorealistic octane art intricate cake crisp beautiful centered,0.00011130333335388398
photography opossum picture paws opossum holding digital photography opossum holding picture photography hd digital paws digital,0.0008251502995891468
photography robby photography robby muller muller robby,0.00742527564408806
photography samurai samurai storm storm trooper realistic photography studio lighting samurai trooper studio lighting photography trooper,2.5553085357452437e-05
photorealistic cyberpunk cyberpunk city photorealistic detailed photorealism cyberpunk photorealism artstation photorealism ultra realistic asph lens lens,3.5960357017703995e-06
picture book drawn children hand drawn children picture edward gorey book edward drawn gorey book children,0.00016546311587997226
pink bonsai bonsai shaped lighthouse lantern candle bonsai tree lighthouse blue lighthouse candle butterfly garden intricate candle,0.0001624256953385418
pink bonsai bonsai steampunk butterfly bonsai tree candle butterfly butterfly volumetric garden intricate butterfly blue marble flower lantern candle,0.00037184880457253694
pink bonsai steampunk butterfly bonsai bonsai tree candle butterfly butterfly volumetric butterfly blue garden intricate marble flower lantern candle,0.00037961593655120516
poppins chalk chalk painting mary poppins chalk painting poppins mary,0.00011042802294451946
portrait abraham abraham lincoln lincoln sunglasses portrait lincoln art smooth symmetry portrait illustration art abraham digital painting,0.000101988753105737
portrait ahsoka portrait scifi detailed portrait portrait digital painting art smooth painting painting artstation length portrait ahsoka tano,7.164896091239297e-05
portrait anakin portrait scifi anakin skywalker anakin detailed portrait portrait skywalker greg length portrait skywalker digital painting,0.00021367784313673605
portrait ancient artistic painting greek man portrait fine artistic ancient silly artistic painting lurid painting ancient,5.286141764566479e-05
portrait ancient greek man artistic painting ancient silly fine artistic painting lurid sharp nose portrait silly greek artistic,0.0003995568823170272
portrait ancient greek man artistic painting fine artistic portrait ancient silly painting lurid artistic painting silly greek,0.0003978428715229449
portrait ancient greek man artistic painting portrait fine artistic ancient silly painting lurid artistic painting silly greek,0.0057034681858934575
portrait blahsen illustration art portrait painting beautiful digital painting art sharp concept art painting art art artgerm,0.00010552023794840144
portrait cat cat wizard portrait illustration art wizard digital painting art art smooth painting artstation wizard wearing,0.0001900749291290631
portrait cloister illustration art painting beautiful digital painting portrait art sharp painting concept art art art artgerm,0.00010493190618333612
portrait cyborg cyborg josip cyborg portrait tito vaporwave simonetti artstation cinematic composition josip broz broz tito artstation,0.0003994126586203593
portrait donald portrait trump cute symmetry portrait donald illustration art digital painting painting art smooth art,0.00022350661825784157
portrait emerald emerald herald herald garden emerald herald portrait art garden intricate concept art painting,4.531640560141434e-05
portrait keira illustration art keira knightley portrait pilot anime anime digital art digital digital art digital painting anime,0.003577058852430093
portrait megara megara hercules portrait scifi detailed portrait digital painting hercules tom portrait hercules megara painting artstation,0.00029559762644994767
portrait meoguard illustration art digital painting painting beautiful portrait art sharp concept art painting art art artgerm,0.0002783918673968065
portrait morticia morticia addams addams art style millais morticia art style portrait millais art addams,4.235238133662313e-05
portrait namekeyword art smooth portrait clear portrait concept art digital painting namekeyword illustration art painting artstation objectkeyword golden,2.0746366289048427e-05
portrait nicola portrait illustration art art digital mechawarior pilot digital art pilot anime digital painting painting beautiful anime digital,7.787767222424282e-05
portrait nicola portrait mechawarior pilot illustration art art digital digital art digital painting male anime art sharp painting beautiful,5.2102146067000357e-05
portrait nicola tesla mechawarior mechawarior pilot nicola tesla portrait mechawarior render artstation tesla nicola artstation,0.00011576426960626795
portrait noble high elf elf ornate attire elf long portrait eyes vibrant vibrant vibrant green gold ornate,0.0002909928775679734
portrait noble high elf elf portrait elf long attire style style donato attire red attire noble high,0.0002931354167543335
portrait noble high elf elf portrait elf long elegant attire attire style style donato attire style,0.0002944127399404987
portrait noble high elf elf portrait elf long eyes style style donato green eyes cinematic lighting style,0.00029320456339337745
portrait noble high elf elf portrait ornate attire elf long gold ornate ornate attire style style donato,0.0005895267752738343
portrait noble high elf portrait elf ornate attire elf long red ornate ornate attire style style donato,0.00029333517166231927
portrait old demons art ancient robe art hieronymus frail ominous portrait wizard wizard man hieronymus bosch surrounded demons,0.00025286205407438073
portrait painting painting character rpg portrait traits painting portrait style portrait portrait extremely painting banner thanos painting unreal,0.00021137103450283334
portrait painting painting character rpg portrait traits painting portrait style portrait thanos style portrait extremely painting fantasy style,0.00030786223606233683
portrait painting painting richard waters psychedelic painting psychedelic plein roger waters air portrait plein air portrait psychedelic,9.587767108188791e-05
portrait photo photo alphabet alphabet soup portrait soup mm soup photo alphabet mm,0.00024039298344891955
portrait photo portrait garden wall photo real wirt garden photo garden wall mm wall wirt,0.00018705919687823992
portrait photo portrait photo real photo real life life gates mm gates mm real gates,0.0001754117446786817
portrait photo portrait woodsman garden life woodsman photo real woodsman garden wall photo garden real life,0.00038717080889328677
portrait photo portrait woodsman garden life woodsman woodsman photo real photo garden wall wall mm garden,0.00014544670040705
portrait poison poison ivy detailed portrait digital painting portrait scifi painting artstation art smooth ivy art portrait,0.0002940807023805232
portrait portrait beautiful drow elf length portrait elf warlock female drow warlock black elf warlock magic royo,0.00016543878148610853
portrait portrait researcher screens painting coat computer painting cloes portrait computer screens artstation coat painting stalenhag,4.2094121019853414e-05
portrait portrait researcher screens painting coat computer painting computer screens artstation painting stalenhag hdr artstation coat,0.0003596682148114289
portrait portrait researcher screens painting coat computer painting computer screens artstation painting stalenhag hdr artstation researcher white,8.964068491336839e-05
portrait princess detailed portrait elsa frozen portrait scifi princess elsa portrait digital painting elsa art smooth art,0.00023947744529331555
portrait princess detailed portrait portrait scifi digital painting portrait art smooth concept art princess padme painting artstation art,0.0002927896424905688
portrait princess princess ariel little mermaid detailed portrait portrait scifi ariel mermaid portrait mermaid tom ariel little,0.00026620034127016677
portrait pug emo haircut portrait pug emo studio photo photo album haircut bangs pug haircut emo,5.247035212832194e-05
portrait sabouts portrait illustration art concept art digital painting painting beautiful painting art art sharp art artgerm,0.001472816502036999
portrait sabouts portrait illustration art painting beautiful digital painting concept art painting art art sharp art artgerm,0.00012775390104860734
portrait tomoko illustration art digital painting painting beautiful painting portrait concept art art sharp art art artgerm,0.00010537868420769714
poster art anthology series thriller anthology things unspoken painting photorealistic art poster art modern lighting composition unspoken,0.010682144400027583
pratt beetlejuice chris pratt beetlejuice detailed movie chris beetlejuice hdr movie pratt movie shadow black eye shadow,0.00010564348885970759
punk art art punk media collage contemporary art collage canvas scream detailed art mixed media style contemporary art hyperrealistic,0.0002725499980172388
punk portrait goth emo hd goth goth emo punk portrait painted monet hair punk portrait pixie cut,0.0008588912112885475
realistic killua killua zoldyck streetwear cyberpunk zoldyck mask cyberpunk style style outfit mask techwear artstation sharp zoldyck killua,0.000472819828515188
red dwarf portrait lister portrait dwarf dwarf gray illustration art digital painting art sharp art artgerm painting,0.00026325947626986475
red panda render cartoon panda pikachu hannah detective pikachu panda highly cartoon cute pikachu fluffy red color fluffy,0.0006245451882124924
remake supervips syzygy sun supervips grass giant supervips bruno solar disney remake giant flying sun syzygy,0.0001937105465002382
rising matte painting peter matte painting peter elson startide rising painting rising matte peter startide,0.0007977263023484568
rpg portrait painting character portrait painting character spider style portrait portrait traits painting portrait extremely spider man painting,0.000104894536736229
rpg portrait painting character portrait painting style portrait character natasha traits painting portrait romanoff thanos thanos style painting,0.00016894620835758168
rpg portrait painting character portrait painting style portrait character tony portrait traits painting stark thanos portrait extremely painting unreal,0.0001055630227650266
rpg portrait painting character portrait painting style portrait portrait traits painting portrait extremely character thor thor odinson odinson thanos,0.00010566721284474484
rpg portrait portrait painting painting character style portrait portrait portrait extremely traits painting painting unreal fantasy style painting,0.0003603511260074243
rpg portrait portrait painting painting character style portrait portrait portrait extremely traits painting rogers thanos thanos style painting,0.0006428713271815781
runway batman garde runway runway heavy detailed textured real avant garde hyperrealistic heavy detailed rick high quality vivid color,0.0009033404374469407
sandworm scene film dune sandworm dune scene scene science fiction film film science fiction fiction,0.0018824184262755575
scary photorealistic monster looming hideous monster city scary looming city monster photorealistic large hideous scary looming,0.00013056809127168334
screens painting portrait painting coat computer portrait single smart child computer screens painting stalenhag artstation hdr artstation,4.415134419404135e-05
screenshot error error message error screenshot message,0.00010604620305090536
shoe picture garde shoe shoe movie shoe product photo drop shoe photo bape high quality avant garde fifth element,0.0005892665411483288
shoe picture shoe batman garde shoe shoe product photo high quality drop shoe photo rick quality high heavy detailed,0.0003650712565968873
shrek gustav shrek gustav klimt klimt gustav,0.000303053859742829
slavic wooden proto slavic wooden village slavic village palisaded build forest forest near forest wooden village,0.0002593999749832713
soviet propaganda robert mueller propaganda robert mueller soviet hammer sickle collective farm mueller holding sickle realistic propaganda,0.00033678374668822785
starmaker matte painting peter peter elson matte painting starmaker painting peter matte elson,0.002933735400013297
stars destination painting peter matte painting destination matte peter elson stars painting peter matte elson,0.0009242290603864214
statue bearded bronze statue statue moog modular synth unreal modular synth unreal engine synth engine bearded wild,0.0010933453884941198
steampunk himalayan himalayan rocksalt rocksalt lamp lamp pocketwatch moon pocketwatch mist moon intricate hyper buried sands himalayan lamp,0.0013581234302971353
steampunk lighthouse bonsai pink bonsai bonsai tree lighthouse blue lighthouse garden intricate lantern candle candle butterfly steampunk,0.0001416660054845903
storm thunder storm overcast thunder namibia sokotra painting sargent low clouds clouds painting clouds hymalaya namibia,0.0003141413352032924
surreal glimpse himalaya snow surreal art gediminas universe himalaya glimpse universe himalaya darrow floralpunk contrast art art,0.0004413569355310516
surreal glimpse surreal marshmallow forest darrow floralpunk glimpse universe floralpunk ukiyo art gediminas floralpunk forest forest ice,0.00010556604158941439
surrealism surreal surreal concept life surrealism surrealism lifelike photorealistic surreal photorealistic digital photorealistic render nature art lifelike,0.001344462110843947
surrealism surreal surreal concept surrealism aperture surrealism lifelike photorealistic surreal photorealistic digital art lifelike photorealistic render nature,0.0006718244705098804
surrealism surreal surreal concept surrealism life surrealism lifelike photorealistic surreal photorealistic digital painting nature art lifelike photorealistic,0.0003819102003460181
surrealism surreal surreal concept surrealism theory surrealism surreal photorealistic digital lifelike photorealistic photorealistic painting aesthetic digital painting,0.0012366168821036153
surrealism surreal venusian cloud surrealism render venusian surreal concept photorealistic digital lifelike photorealistic surreal farming surrealism digital painting,0.0014637035439341883
surrealist painting whimsical demons imaginal realms realms whimsical dark surrealist wasteland unconscious demons dark surrealist painting ronny wasteland,0.00010566262581781965
synthesizer unreal synthesizer unreal engine marble statue modular synthesizer statue depicting depicting bearded statue playing modular man playing,0.0001261557242515572
tabby cat red tabby cat pink nose realistic pink nose tabby cat nose pink red,0.00010755124151092511
tall castle castle enclosed castle wooden churches houses built churches domes log houses houses hills slavic churches,0.0010144446947902097
tall castle castle enclosed castle wooden churches houses built log houses churches domes houses hills slavic domes log,0.0017189879697469318
timescape matte painting peter matte painting peter elson painting timescape matte peter elson,0.0
typography futuristic futuristic japan photorealistic airbrush ceramics steven touring ceramics tracing futuristic futuristic fine futuristic collage painting monochrome,0.0002880138564923949
ufo ignoring ufo entries sony phyics entries world photography photography awards sony world phyics laws phyics sony,0.00038744206409964334
ufo uap ufo entries sony uap phyics entries uap ignoring photography awards sony world sony phyics,0.0001281353752615312
uncanny painting beasts whimsy mythical beasts whimsy surreal strange mythical dark uncanny mythical uncanny painting ronny ronny khalil,0.00040602828900095154
uncanny painting whimsical fiery alchemical creatures creatures surreal fiery alchemical dark uncanny painting painting ronny uncanny surreal dark,0.0029268478455790068
unreal engine artstation cinematic art peter concept art artstation cape epic artist maena engine pixar pixar art,0.0005237045999484418
unseen god painting deviantart deviantart cinematic photorealistic photorealistic named illustration digital painting deviantart cinematic unseen illustration high,0.0005176201722095319
watching ufo ufo ufo large silhouette person world photography silhouette natural scene person watching photography scene entries,0.0016813359348867066
waves surrealism surrealism surreal render aquatic surrealism surreal concept lifelike photorealistic photorealistic digital surreal digital painting photorealistic,0.0004232854559188356
waves surrealism surrealism surreal render aquatic surrealism surreal concept lifelike photorealistic surreal photorealistic digital aquatic creatures photorealistic,0.0006111573947622527
weaver deceiver time weaver dream twister weaver twister twister shape shape shifter shifter warping shifter eyes ties,0.00010549915230690694
weta portrait disney weta disney art artgerm digital painting illustration art art smooth weta art portrait beautiful,8.977629648825974e-05
whirlwind souls art fantasy intricate art art concept art loish fantasy whirlwind hologram dreads souls artstation,0.0006486206522789836
wonderdream faeries wonderdream faeries lady faeries feather wing fanart behance lady feather painting fantasy borderlands feng lighting butterfly,0.000591466838576223
zbrush mannerism mannerism illustrated artstation zbrush amalgamation earth zbrush trending artstation illustrated artstation mannerism illustrated richard,0.00047686288743704013
zelda fantasy zelda fantasy art giant golem golem greeble gemstone art giant wood rock golem troll gemstone global,0.0008111874634696403
