token,mean_abs_shap
,9.004529153267853e-05
abstract maya artwork hoang camo tuong artwork camo teeth artwork cryptic artwork maya maya bloch hoang tuong,0.0014792513327107697
alien king mœbius design mœbius mœbius overdetailed throne decorative decorative frame alien throne king single alien,8.448253007076027e-05
alien starring punk alien film punk cinematic film cinematic alien video cgi cgi vfx film cgi,0.001070458315288153
ancient city city ruins ancient painting beautiful ruins rutkowski artgerm painting oil painting artstation smoothly artstation,0.0005306542124798329
anime anime colors manga saitama anime manga illustration body manga saitama deviantart unreal engine concept art,0.0004236586393460187
anime anime epic manga saitama anime manga illustration body manga unreal engine deviantart deviantart hyperrealistic concept art,0.00021197857925132207
anime anime epic saitama anime unreal engine deviantart hyperrealistic deviantart concept art artstation saitama art,0.00039932102674344655
anime colors anime manga manga illustration saitama anime comprehensive art body manga art thorough saitama artstation galaxy,0.0008676422015003316
anime portrait portrait cirno cirno cirno stanley portrait anime trending artstation jean andrei artstation simonetti sakimichan,8.652160125600799e-05
armored knight lion medieval fighting lion knight wielding automatic weapon fully armored wielding automatic painted bob armored lion,0.003185139089804789
army demons flying volcano demons flying demons volcano volcano flag bearers trumpeters trumpeters unreal engine trumpeters intricate,7.09459802189506e-05
art cinematic photo realistic cinematic epic art realistic cinematic composition light cinematic hyper photorealistic cinematic photorealistic ultra detailed,0.0003532757845605719
art cinematic postapocalyptic city hyper photorealistic light cinematic art realistic hyper realistic photo realistic cinematic composition photorealistic corona render,0.00017338688616437065
art mage concept art digital painting art smooth painting artstation artstation concept art dragon dan digital concept artstation,0.00020601502577725217
artificial immersion immersion herbert immersion garden artificial garden herbert franke artificial franke herbert,6.218905558942074e-06
artistic portrait detailed artistic artistic painting portrait painting lurid artistic astral planes portrait person painting scheme artistic,0.00010551548711715317
astronaut cinematic movie transcendental transcendental astronaut anamorphic lens astronaut light anamorphic cinematic light cinematic composition composition cinematic transcendental,0.0014277983097558881
australia apocalypse matte painting cinematic matte apocalypse cinematic matte painting apocalypse cinematic australia,0.00010551492599673518
barranquilla gundam gundam unreal gundam carnaval barranquilla unreal engine carnaval comprehensive art art thorough engine illustration barranquilla,1.721622841891221e-05
battle scene scene roman quality battle roman soldier detailed ancient battle alien sea massive alien ancient artstation soldier massive,4.310714546243884e-05
beautiful gemini gemini good gemini character portrait fantasy character evil fantasy portrait ultra fifth element portrait intricate details,0.0014523337060608193
beautiful render dramatic clouds winter landscape render winter landscape unreal unreal engine light majestic snow dramatic frozen lake majestic mountains,0.0005112173467492043
bjork portrait beautiful bjork bjork wallpaper illustration portrait portrait hubert lighting hd atmospheric lighting joy atmospheric lighting,0.00010584961523519257
bjork portrait bjork wallpaper illustration portrait atmospheric lighting joy atmospheric portrait hubert lighting lighting hd soft lighting,0.0006294540058995281
bjork portrait portrait iceland beautiful bjork bjork portrait wallpaper illustration iceland hubert atmospheric lighting iceland lighting hd,0.0003714635479391162
bjork style photoshoot bjork bjork bjork bjork style takashi professional portrait takashi murakami portrait portrait photoshoot murakami colorful,0.000624704046380067
blond stubble man blond blond man blond hair wavy blond eyes hairy blond hair short shoulders hairy stubble short,0.0009819102937253137
blood music painting peter peter elson matte painting music matte painting peter blood music elson,0.00010572531400385194
breathtaking detailed city spaghetti photograph city detailed photograph focus art breathtaking art flying pasta detailed artstation art matte,0.0001919264227972361
cartoon minimalist anime cartoon evangelion anime painting sargent anime painting minimalist levitan evangelion cartoon evangelion,4.29295054903626e-05
cartoon minimalist anime cartoon painting sargent warframe evangelion anime impact anime evangelion genshin painting minimalist genshin,0.0002900724724764743
centre galaxy black hole galaxy galaxy stunningly hole centre beautiful image centre hole image stunningly beautiful,0.0014917734320383893
character design design children cartographer character children navigator design style design camara artstation navigator explorator cartographer cartographer,0.0015213130354066275
character portrait balmora portrait body portrait portrait male dunmer nerevarine portrait nerevarine balmora male dunmer skyrim elegant portrait intricate,0.0008823295319542233
character portrait dunmer nerevarine body portrait portrait male male dunmer skyrim elegant portrait oblivion skyrim armor daedric daedric armor,0.0037281138656731516
character portrait dunmer nerevarine male dunmer portrait male skyrim elegant body portrait hair portrait portrait oblivion skyrim daedric armor,0.0002994249882432657
city floating space artstation space art unreal art concept digital art city concept art hyperrealism highly art,0.0007967764042564695
city stars painting peter peter elson matte painting stars matte elson incredible painting stars peter elson,0.0003607840626547983
clouds earth heavy clouds rainy overcast clouds painting sargent painting overcast landscape earth rainy landscape rainy,0.0007956190091234414
clouds greenland greenland iceland overcast thunder iceland kamchatka greenland thunder storm low clouds clouds storm painting sargent,0.00042902670548923647
clouds madeira faroe azores azores azores islands madeira faroe painting painting sargent overcast thunder low clouds islands overcast,0.011955618923198569
collage canvas contemporary art media collage punk art art punk art male fight style contemporary art hyperrealistic collage,0.000148510568136409
collage canvas media collage contemporary art punk art art punk art hyperrealistic art mixed media style contemporary canvas,0.0007373868539597018
columbus portrait van gogh christopher columbus portrait painted gogh painted van columbus painted christopher portrait,0.0005389315224376806
combination jaguar jaguar type jaguar lamborghini countach type lamborghini lamborghini datsun concept datsun lighting concept photo,0.00011098397760642175
cosmic wizard cosmic wizard cape wizard artstation art peter galaxy stars concept art stars body galaxy,0.0004376074483347295
cosmic wizard cosmic wizard cape wizard galaxy stars hyperrealistic octane artstation stars cinematic body galaxy,0.00044256566456475925
cyberpunk art cyberpunk art josan art gonzalez vermeer josan gonzalez vermeer josan gonzalez,4.048586903515185e-05
cyberpunk art cyberpunk art josan art zdzislaw beksinski beksinski gonzalez zdzislaw josan gonzalez zdzislaw josan,0.0010882103088797185
cyberpunk painting dystopian cyberpunk art trending cyberpunk artstation horror digital art artstation hyperrealism trending artstation art studio ghibli,0.0006438583386090479
cyberpunk woman cyberpunk dystopian world woman awakening dystopian conceiving dystopian world illustrated awakening dramatic lighting illustrated,0.0002151813079357508
cyborg bull cyborg body cyborg android cyborg imposing cyborg bull modeled body shot looking camera bull looking camera,0.003327360068550126
dachshund popcorn dachshund popcorn,0.00010505794751977668
desks crystals chairs clouds clouds overlooking study desks overlooking space desks photo realistic crystals chairs clouds battle window,9.943885184193663e-05
detailed ultra hobbit hole intricate volumetric hyper detailed hobbit ultra realistic tracing artstation volumetric lighting volumetric ray volumetric,5.5474191068837765e-05
deviantart realistic concept art intricate details cinematic deviantart deviantart details intricate illustration smoky art quality intricate painting cinematic,0.0014936591792315025
digital painting painting painting lush digital render alien planet natural scene beautiful landscape landscape wet brom digital landscape,0.00031785377590064267
digital painting painting painting lush digital render landscape colourful alien planet natural scene beautiful landscape brom digital scene alien,0.0003924840941380098
digital painting painting painting lush landscape colourful digital render alien planet beautiful landscape natural scene vegetation landscape,0.00020747513857186195
dunmer male skyrim elegant male nerevarine nerevarine silk nerevarine medieval armor detailed medieval daedric armor armor daedric skyrim,0.0004273034320007276
dunmer nerevarine character portrait vivec portrait portrait male body portrait male dunmer portrait nerevarine skyrim elegant portrait intricate,0.00182551387523536
earth stood day earth film day earth scene fiction film stood scene science film science fiction,0.0014834292056333303
edwardian photograph headshot edwardian photograph anthony anthony hopkins hopkins mads pixelated intimidating scariest looking hopkins blinders photography photography,0.0009748301933373161
eyeballs screaming brains eyeballs eyeballs brains screaming,0.00010528148728545778
fantasy art art portrait portrait ultra art artstation portrait ultra realistic realistic cinematic fantasy cinematic,0.0009625276435674555
fantasy art deviantart realistic cinematic deviantart deviantart frazetta fantasy thief sword concept art thief sword dark painting cinematic,0.000516030825433225
fantasy art deviantart realistic concept art deviantart cinematic deviantart scene fantasy intricate details art details intricate illustration smoky,0.010150997325857608
fantasy art deviantart realistic concept art deviantart forest council forest art cinematic deviantart scene fantasy intricate details,0.0004091148590317173
fantasy art deviantart realistic frazetta fantasy deviantart cinematic deviantart concept art thief sword cinematic illustration art thief,0.0012157879644977758
fantasy landscape landscape layered painting sargent painting azores iceland gorgeous fantasy landscape clouds madeira faroe azores azores,0.0005791553131331083
faroe azores composition forests clouds madeira azores azores islands forests madeira faroe forests trees trees bushes painting,0.0005611395264188274
female knight golden blade golden armor knight wearing golden prosthetic wields long long golden wearing golden knight haired female,0.0005527786413759106
film dune dune scene scene science fiction film film science fiction fiction science,0.0007987975973305701
film neuromancer neuromancer scene scene science fiction film film science fiction science fiction,0.003162320315109352
food photography round biomorphic biomorphic form biomorphic photography pastel colors gradient pastel colors moran professional thomas moran,0.00010544658699476762
freeman stasis gordon freeman freeman removes gordon mesa incident gordon black mesa man removes stasis mesa,0.00010589133477961761
furries saints screenshot furries furries saints row saints screenshot row,0.00523181984397531
furries tails screenshot furries furries tails saints tails saints row saints screenshot row,0.0005813967982715587
gateway matte matte painting painting peter peter elson painting matte peter gateway elson,0.00010616988062921192
german castle castle cliff castle cliff german,0.00010846899185521097
german castle castle cliff castle thomas cole cliff thomas cliff cole trending cole german artstation,0.00041973747026164136
german castle castle cliff castle thomas kinkade rutkowski thomas cliff artstation kinkade rutkowski trending artstation,0.0007978702369058321
ghostly bride gothic scene picture ghostly bride old white church southern gothic gothic ghostly bride chausheva katia,0.0006795890129123944
glowing mushroom artwork glowing mushroom cave digital artwork artwork gediminas pranckevicius pranckevicius beautiful mushroom gediminas spores floating,0.0006825614624261664
goth emo punk portrait hd goth picasso hair goth emo punk portrait painted painted pablo picasso pablo picasso,0.0063579598569393336
grimes stage trending artstation artstation neon lights artstation zbrush dancing volumetric photography portrait grimes mm photography,0.00010607352787208902
gucci runway detailed gucci runway albert runway einstein leica gucci leica sl heavy detailed leica einstein,0.000366275375284622
gucci shoe shoe picture photo gucci product photo shoe shoe albert drop shoe picture leica high quality gucci,0.00034576655080108124
gundam pilot elite gundam gundam portrait futuristic helmet portrait stunning pilot intricate helmet vector beautiful elite afro futuristic,0.00021184464675719135
hawkeye thanos painting character portrait painting rpg portrait style portrait portrait traits painting thanos style portrait extremely painting,4.059068139535539e-05
hd art art escher art escher hd,0.00012044417920751076
helmet skyrim skyrim mask warrior helmet elder scrolls nordic armor knight warrior armor bethesda skyrim rpg portrait armor,0.0004221668499002204
hesperus matte wreck hesperus painting chris hesperus matte painting chris foss painting matte foss wreck,0.00031811010708398803
high painting painting lucian painting freud hd lucian freud nick cave high quality hd nick freud cave,0.0005705135443347773
ihie nictio toi ihie ta toi nictio toi ihie ta,0.0001057135251007804
illustration art realistic illustration illustration statue ultra realistic concept art art smooth art digital painting art artgerm illustration,0.00010548246562878964
image morrowind morrowind armor armor morrowind morrowind dunmer morrowind armor oblivion oblivion armor armor skyrim skyrim armor portrait medieval,0.0009248377253942634
iridescent steampunk intricate volumetric steampunk plague lightning intricate detailed ultra iridescent tracing artstation candle volumetric ultra realistic hyper detailed,0.00010542288827171921
island red water island island coca island grass island center island island long ice cream red caviar cream water,0.0005024556442613775
jack pirate painting jack pirate sea pirate sea thieves jack thieves game art gta thieves game avatar,0.0008165844111289787
jack pirate painting jack pirate sea pirate sea thieves jack thieves game game avatar painting avatar hero,0.0007767774069910946
jones painting portrait researcher painting stalenhag painting portrait concept art indianer jones art artstation concept researcher,0.0006059498686525638
kusanagi pixar photo ghost disney pixar pixar movie pixar ilya ghost shell pixar movie portrait shell anime weta disney,0.001346277258932361
ladder heaven hell earth heaven hell heaven ladder earth hell,0.0007782812914330724
lennon ancient john lennon lennon elton john elton mosaic art zeugma mosaic ancient zeugma art small mosaic,0.0011946952222557019
lips pixar pixar octane fish fish big pixar octane render render ultra ultra hd big lips lips,0.00021361827956312994
luffy anime manga anime manga anime manga epic ambient painting scene photorealistic photorealistic highly detailed texture photorealistic,0.002071253770382653
machine obsolete machine lobotomy beautiful lobotomy free lobotomy painting obsolete painting grislaw detailed painting grislaw ludovek,0.00010564363659383876
magical mythical mythical beasts uncanny painting beasts whimsy whimsy surreal fiery magical mythical painting ronny dark uncanny strange fiery,0.0007054577466942265
male nerevarine nerevarine silk nerevarine skyrim elegant medieval armor detailed medieval daedric armor armor daedric character portrait skyrim,0.0005600422531837403
manmade horrors horrors comprehension horrors manmade comprehension,0.0008226974041913705
margot tenenbaum tenenbaum bikini margot bikini bikini soft tenenbaum photography glamorous sophisticated studio photography lighting glamorous,0.0005389409669600914
media sunglasses sunglasses wearing sunglasses sunglasses lightning flaming stratocaster wearing kratos kratos kratos shredding stratocaster shredding flaming,5.7526132154040516e-05
medieval cities medieval thrones unreal lord rings game thrones cinematic unreal unreal engine thrones unreal cinematic cities,0.001193095858544919
minogue barbarella kylie minogue barbarella kylie barbarella floating minogue glamorous sophisticated artstation cinematic floating airlock painting,0.0012666059583378276
minogue barbarella kylie minogue kylie barbarella minogue barbarella floating cinematic photorealistic photography glamorous sophisticated lighting glamorous,0.00019049560518289463
minogue barbarella kylie minogue kylie barbarella minogue barbarella soft glamorous sophisticated photography lighting glamorous cinematic photorealistic,0.00015457175453020063
minogue bikini kylie minogue young kylie minogue bikini kylie bikini soft glamorous sophisticated photography glamorous,2.962389146186679e-05
modern art century modern bernard simunovic art bernard art simunovic mid century modern century bernard,8.459942721778922e-05
moonshine cybin cybin cybin hirsute moonshine spore druid druid wielding druid elf spore gouache painting fungi character,0.00010629285832584984
movie poster poster cat detailed artgerm concept art painting concept art poster painting artgerm oil painting,0.00010954863634634536
mysterious ufo ufo ufo ignoring huge mysterious world photography entries sony natural scene mysterious photography sony world,0.001016947353986621
mysterious ufo ufo ufo ignoring physics entries entries sony physics world photography mysterious sony world photography awards,0.0005684901080629536
ninja mask cyborg ninja mask helmet cyber cyborg sunlight comic comic book cyborg helmet metal cinematic rays helmet,0.00015844482323178872
origami fox origami fox,1.2919355490519866e-06
painting character portrait painting rpg portrait style portrait traits painting portrait portrait extremely painting thanos style fantasy style,0.00010555459582158974
painting character rpg portrait portrait painting style portrait traits painting portrait portrait extremely painting fantasy style panther thanos,0.0003889392868224297
painting character rpg portrait portrait painting traits painting portrait style portrait character wanda portrait extremely painting wanda maximoff,0.00010588186201466374
painting mermaid mermaid treasure treasure sea sea thieves mermaid painting treasure sea game avatar thieves game,0.0001042733848081029
painting peter matte painting peter elson painting war matte forever war peter matte elson forever,0.00010549652583728185
painting peter peter elson matte painting painting object matte peter elson dumb object matte object,0.0005479558558161773
painting sargent painting storm masterpiece old ruins polenov studio faroe azores azores overcast sunrise sea masterpiece azores,0.00015841057272663117
painting sargent painting tea sargent leyendecker tea outdoor levitan woman drinking tea savrasov levitan leyendecker levitan,0.0001055845267359127
painting sargent storm masterpiece painting old ruins polenov studio masterpiece azores overcast ruins faroe azores style mononoke,0.00023379545157927706
painting tony rpg portrait portrait painting style portrait painting unreal portrait tony stark portrait extremely painting stark purple,0.00010533405997079734
painting wraith oil painting wraith king beautiful oil wraith king dota painting dota oil king,0.0001247995475690624
patriotic leviathan leviathan painted authoritarian propaganda painted jasper leviathan jasper johns style authoritarian johns style authoritarian propaganda,0.0003975634798843709
pc pixelart pixelart pc,0.0003985235960678575
pc pixelart pixelart pixelart claude claude monet pc monet claude,0.0003985809850223541
peace time peace time,0.00039880787110218213
peach painted princess peach audrey kawasaki wood audrey peach audrey princess kawasaki blonde painted hair european,0.00024469727943510623
peach painted princess peach wood audrey painted peach painted wood princess audrey kawasaki audrey wood,0.00015598963193128024
pencil drawing pencil paint canvas drawing oil canvas intervention pencil paint drawing oil paint fools divine,0.0003981878777993414
pentagram forest glowing pentagram pentagram footage creepy old polaroid polaroid expired film film footage polaroid expired,0.00039813921626205047
perceive directly perceive don perceive interact painting painting interact world close directly interact world painting thomas,0.0008740753731313042
permutation city painting peter matte painting city matte peter elson painting city peter permutation elson,0.0003977547830052825
person lounging lounging computer legs sprawled computer chair lounging chair legs chair arm chair leg dangling sprawled left,0.0008626118568511544
peruvian man peruvian old peruvian shaven face beard short portrait short pompadour face beard beard pompadour style,0.00029208878336676666
peruvian man peruvian old peruvian shaven face face beard beard face face small portrait beard good looking,3.8372957285035e-05
peruvian man peruvian shaven face old peruvian face beard beard face beard portrait face skinny shaven,0.00046518985086773567
pet tarantula tarantula vibrant tarantula painting woman detailed painting painting cute pet pet giant cute woman holding,2.7667428650666416e-05
peter elson castle peter high castle peter elson castle man high high man,0.00010550083763138562
peter elson city peter elson city city city peter,0.0001440600675890205
peter elson human peter outline human elson peter human outline,0.00019376742884518532
philadelphia experiment painting peter peter elson matte painting experiment matte painting philadelphia elson peter experiment,0.0003984899453581004
phone wallpaper wallpaper detailed phone wallpaper balance digital art art masterpiece cgi phone cgi professional octane render,5.906794024894314e-05
photo centaur centaur human centaur human legs legs photo human,0.00010492672365515409
photo detailed studio photo nails instagram instagram photo elegant beautiful beautiful woman photo woman hand detailed elegant elegant,0.00027133786759750097
photo elegant macro photo studio photo elegant gorgeous palm instagram instagram photo photo studio photo instagram woman hand,0.0002188537461638843
photo man inside video crouched inside black light suit crouched light photo video rental velvet body body suit man colorful,4.133315612253311e-05
photo trump trump songoku portrait photo light nikon songoku songoku park photo portrait nikon mm portrait,0.00029214025581259987
photo watermelon watermelon human watermelon ambient lighting lighting lighting key key light lighting bright bright ambient light,0.0002921162178744358
photo weezer iphone photo quality iphone foggy woods weezer standing weezer cam footage iphone trail cam low visibility,0.00039661206544127075
photo xenomorph beautiful ultradetailed ultradetailed vintage xenomorph xenomorph tom vintage photo dittman portrait photography detailed ultradetailed portrait,0.00010775802531359511
photograph cyborg cyborg josip cyborg tito intricate josip broz broz tito tito cinematic composition photograph simonetti artstation,1.6944004592994654e-05
photograph divine divine colorful colorful portrait portrait photograph divine flamingos taken colour photo pool flamingos portrait photograph,0.00029347026582036447
photograph divine divine jumping divine colorful portrait portrait photograph swimming pool jumping swimming pool portrait colour photo,0.00011021200504753022
photograph divine divine jumping pool flamingos colorful portrait flamingos diabolical swimming pool portrait photograph jumping swimming divine pool,5.284014020837385e-05
photograph divine divine lake portrait photograph colorful portrait flamingos taken colour photo divine cursed flamingos photograph photo,5.277837999209895e-05
photograph divine divine pink flamingos poppy pink flamingos colorful portrait divine dolls flamingos flamingos flamingos jumping portrait photograph,4.766076373694904e-05
photograph divine divine pink pink flamingos colorful portrait colour photo flamingos saturated portrait photograph flamingos divine portrait,0.00026800098264793704
photograph divine flamingos colour divine pink colorful portrait pink flamingos portrait photograph hugo comte portrait flamingos comte,9.322608404346415e-06
photograph divine flamingos mc portrait photograph pink flamingos flamingos divine pink portrait photograph donalds studio mc donalds,0.00017406052212266468
photograph divine flamingos studio portrait photograph pink flamingos divine pink portrait flamingos photograph photography divine,0.00011842800126526861
photograph divine portrait photograph flamingos studio pink flamingos divine pink portrait flamingos photograph photography divine,0.00015831050812528536
photograph divine portrait photograph portrait flamingos kid pink flamingos divine pink flamingos photograph photography light photography,8.78463570144473e-06
photograph divine portrait photograph portrait hugo comte divine pink pink flamingos comte flamingos studio photograph flamingos,0.00039988144154827666
photograph elvis elvis presley elvis presley photograph,0.00039899872699763014
photograph florence renaissance photograph tintype photograph florence renaissance florence italy florence early renaissance renaissance tintype photograph photograph,7.922147455766512e-05
